{
  "check_count": 17,
  "checks": {
    "api_allowed_write": true,
    "bundle_matches_expected_checkpoint": true,
    "denials_have_zero_upstream_calls": true,
    "identity_revocation_denied": true,
    "mcp_allowed_write": true,
    "missing_evidence_denied": true,
    "out_of_scope_denied": true,
    "signatures_committed_before_both_writes": true,
    "signer_and_identity_ready": true,
    "signer_outage_blocks_dispatch": true,
    "signer_outage_readiness_false": true,
    "single_use_approval_replay_denied": true,
    "standalone_public_verifier_after_private_state_removed": true,
    "stored_chain_valid": true,
    "tampered_record_rejected": true,
    "truncated_snapshot_rejected": true,
    "unauthenticated_denied": true
  },
  "external_services": {
    "aws_kms": "NOT_RUN",
    "physical_hsm": "NOT_RUN",
    "sigstore_issuance": "NOT_RUN"
  },
  "fixture_scope": "Ephemeral local IdP and synthetic HMAC reviewer/test evidence; real loopback sockets and independently witnessed file writes.",
  "generated_at": "2026-10-01T01:04:32.572471+00:00",
  "passed": true,
  "receipt_count": 9,
  "schema_version": "wave16.crypto_authority_ci_summary.v1",
  "upstream_invocation_count": 2
}
